{
  "schema_version": "1.0.0",
  "case_uuid": "00000000-0000-4000-8000-000000000004",
  "patient_id": "PSEUDO-89607",
  "laterality": "OS",
  "laterality_source": "inferred",
  "captured_at": "2026-08-26T10:32:11Z",
  "device_id": "CAM-FIXTURE-01",
  "operator_id": "TECH-FIXTURE",
  "attempt_number": 1,
  "quality": {
    "grade": "C",
    "decision": "recapture",
    "reason": "Out of focus - refocus on the optic disc and recapture.",
    "features": {
      "focus_score": 0.18,
      "illumination_uniformity": 0.3,
      "vessel_resolvability": 0.12,
      "field_coverage": 0.97,
      "contrast": 0.35,
      "saturated_fraction": 0.002,
      "crushed_fraction": 0.001,
      "optic_disc_detectable": false,
      "macula_visible": false
    }
  },
  "prediction": null,
  "triage": {
    "level": "P0",
    "abstained": false,
    "escalation_rules_fired": []
  },
  "lesions": {
    "red_lesions": {
      "count": 0,
      "mean_probability": null,
      "within_1dd_of_fovea": 0
    },
    "hard_exudates": {
      "count": 0,
      "mean_probability": null
    },
    "soft_exudates": {
      "count": 0,
      "mean_probability": null
    }
  },
  "anatomy": {
    "optic_disc": null,
    "fovea": null,
    "disc_diameter_px": null,
    "geometry_selftest_passed": false
  },
  "artifacts": {
    "thumb": "thumb.jpg",
    "review": "review_1536.jpg",
    "overlay_cam": null,
    "overlay_lesions": null,
    "original": null
  },
  "limits": {
    "min_detectable_lesion_um": null,
    "not_assessed": [
      "neovascularisation",
      "diabetic_macular_oedema"
    ]
  },
  "recommendation": {
    "code": "CANNOT_ASSESS",
    "text": "Image could not be graded. Recapture required."
  },
  "versions": {
    "model_version": "fixture-v0",
    "preprocessing_hash": "sha256:fixture",
    "dataset_version": "fixture",
    "pipeline_commit": "fixture"
  }
}